{
  "schema_version": "debark.installreport/v1",
  "started_at": "2026-09-03T14:00:00Z",
  "finished_at": "2026-09-03T14:00:07Z",
  "bundle_path": "/mnt/media/plant4-bundle",
  "bundle_id": "bd-80be0631f286fe7e",
  "verify": {
    "schema_version": "debark.verifyreport/v1",
    "checked_at": "2026-09-03T14:00:01Z",
    "bundle_path": "/mnt/media/plant4-bundle",
    "ok": true, "signed": true,
    "signatures": [ { "signer_kind": "ed25519-file", "key_id": "dGVzdC1rZXktaWQ", "valid": true, "trusted": true } ],
    "files_checked": 5, "bytes_checked": 6300288,
    "target": { "distro_id": "debian", "version_id": "12", "codename": "bookworm", "arch": "amd64" }
  },
  "applied": true,
  "ok": true,
  "to_install": ["vlc=3.0.21-1build1", "acme-agent=2.1.0"],
  "already_current": 1,
  "target_expected": { "distro_id": "debian", "version_id": "12", "codename": "bookworm", "arch": "amd64" },
  "target_actual": { "distro_id": "debian", "version_id": "12", "codename": "bookworm", "arch": "amd64" },
  "base_divergence": {
    "base_id": "debian:12/minimal",
    "assumed": 412,
    "missing": ["ifupdown:amd64", "nano:amd64"]
  },
  "warnings": [
    "this bundle was built against an assumed base (debian:12/minimal), not a snapshot of this machine",
    "2 of the 412 assumed base packages are not present on this machine: ifupdown:amd64, nano:amd64 - the bundle was resolved as if this machine already had them, so it may be short"
  ],
  "apt_output_digest": "ea08eeadaaf778f1c36d5b880e677b8277fddaff3704cde3ea029b85fbd9a34f"
}
